{"$schema":"./nautilus-sandbox-result-v2.schema.json","engine":"CURRENT_CORE_REFERENCE_V1","fresh_process_replay_verified":true,"request_hash":"634b7518b5c18c216a06d513335bfd6858b3100354e9d4e9d7a285573f15fd1f","request_id":"nautilus_v065_request_634b7518b5c18c216a06d513335bfd6858b3100354e9d4e9d7a285573f15fd1f","result_hash":"f4661e2548c058b655f36b42840c31abd16d0d31e36ba4d3218daf0ff034b29f","result_id":"nautilus_v065_result_f4661e2548c058b655f36b42840c31abd16d0d31e36ba4d3218daf0ff034b29f","safety_counters":{"broker_requests":0,"credential_reads":0,"live_adapter_imports":0,"network_requests":0,"production_state_writes":0,"real_orders":0,"second_engine_creations":0},"scenario_results":[{"average_price":"2000.1","ending_cash_usdt":"899.894995","ending_position_eth":"0.05","events":[{"event_hash":"b57f59ea175b73a80eeecb6ca94bc67126068edb2c08eeb5a73703777a3cc3f8","kind":"ORDER_ACCEPTED","sequence":1,"status":"FILLED"},{"event_hash":"57c9f15adcd060ff0f31eb08d4f9c378aa0b567ac4501d2719dec6ec16998709","fee_usdt":"0.100005","kind":"FILL","price":"2000.1","quantity":"0.05","sequence":2}],"fee_usdt":"0.100005","filled_quantity":"0.05","net_pnl_usdt":"-0.105005","realized_pnl_usdt":"0","requested_quantity":"0.05","scenario":"IMMEDIATE_FULL","scenario_hash":"0fda97b3842e7d2f8127e0026b1008e53596c9d5d9b827ea583b3166d1813536","status":"FILLED","unrealized_pnl_usdt":"-0.005"},{"average_price":"2000.16","ending_cash_usdt":"899.891992","ending_position_eth":"0.05","events":[{"event_hash":"b57f59ea175b73a80eeecb6ca94bc67126068edb2c08eeb5a73703777a3cc3f8","kind":"ORDER_ACCEPTED","sequence":1,"status":"FILLED"},{"event_hash":"12e70a1800debad27071f39deaddc91c8946ec89332f843e14055626a56a2c1c","fee_usdt":"0.040002","kind":"FILL","price":"2000.1","quantity":"0.02","sequence":2},{"event_hash":"2bff5272aabef3d42e03cf810fad90abcd8f0faf91f7fc1fd41c07be83726b45","fee_usdt":"0.060006","kind":"FILL","price":"2000.2","quantity":"0.03","sequence":3}],"fee_usdt":"0.100008","filled_quantity":"0.05","net_pnl_usdt":"-0.100508","realized_pnl_usdt":"0","requested_quantity":"0.05","scenario":"PARTIAL_THEN_FULL","scenario_hash":"c8afc2a84fb64d93ae8cf8c7c3f36932b76a228accf7c5b5b8b041022c7abfed","status":"FILLED","unrealized_pnl_usdt":"-0.0005"},{"average_price":"0","ending_cash_usdt":"1000","ending_position_eth":"0","events":[{"event_hash":"7a4b28f4f6ea76ec6bac74d96fa53941edcd7ae5798598ba2b28b772d5d7a910","kind":"ORDER_REJECTED","sequence":1,"status":"REJECTED_MIN_NOTIONAL"}],"fee_usdt":"0","filled_quantity":"0","net_pnl_usdt":"0","realized_pnl_usdt":"0","requested_quantity":"0.001","scenario":"BELOW_MINIMUM_REJECTED","scenario_hash":"3b562c2734304b850d6d1c69889e945c37ba55d1b83934ae95908931acfabcef","status":"REJECTED_MIN_NOTIONAL","unrealized_pnl_usdt":"0"},{"average_price":"2000.1","ending_cash_usdt":"899.894995","ending_position_eth":"0.05","events":[{"event_hash":"b57f59ea175b73a80eeecb6ca94bc67126068edb2c08eeb5a73703777a3cc3f8","kind":"ORDER_ACCEPTED","sequence":1,"status":"FILLED"},{"event_hash":"57c9f15adcd060ff0f31eb08d4f9c378aa0b567ac4501d2719dec6ec16998709","fee_usdt":"0.100005","kind":"FILL","price":"2000.1","quantity":"0.05","sequence":2}],"fee_usdt":"0.100005","filled_quantity":"0.05","net_pnl_usdt":"-0.105005","realized_pnl_usdt":"0","requested_quantity":"0.05","scenario":"FRESH_PROCESS_REPLAY","scenario_hash":"087c55c3dd874c8915dc88acb93845f373cfa99557135b9e75f6b787b0496ac0","status":"FILLED","unrealized_pnl_usdt":"-0.005"}],"schema_version":"2.0.0"}
